{
  "$schema": "https://json-schema.org/draft/2020-12/schema",
  "title": "Coverage Board",
  "description": "A deliberately small board for coordinating finite coverage efforts.",
  "type": "object",
  "additionalProperties": false,
  "required": ["name", "cards"],
  "properties": {
    "$schema": { "type": "string" },
    "name": { "type": "string", "minLength": 1 },
    "description": { "type": "string" },
    "version": { "type": "integer", "minimum": 1, "default": 1 },
    "cards": {
      "type": "array",
      "items": { "type": "string", "minLength": 1 },
      "uniqueItems": true
    }
  }
}
